,index,selftext,num_comments,score,title
39,420,bought wrong ticket accident meant buy ticket printworks london bought belfast anyone interested send pm,0,1,Selling tickets for Bicep in Belfast for £15
249,3878,hello dad co owner house mom divorced re married sister life house want buyout half ok that would get approx k need reinvest soon retired want use money wife get home we would sell condo help issue us money new wife would entitled co owner our house bought dad money something happened wanted money could come u screw u over way legally exempt legal ownership would deed name family would able come u house chose point dad pass agreed would help pay could live u old need care wife pass first would live u go first afraid would come u money anybody know law somewhere find info,0,0,New home puchase
440,7105,hey everyone girlfriend one first people canada register tomorrowland guarantee u tomorrowland package go sale proof ticket sold worldwide spot purchasing queue fill le second guarantee waiting year this need package willing part two experience lifetime opportunity deal serious inquiry only canadian willing meet gta ontario only excludes single day pass dreamville friendship package interested guaranteeing package tomorrowland email adina i tomorrowland gmail com email include name phone number package looking buy and much willing pay them baseline price select top offer a backup incase first offer flop contact via email th january set meet public place within gta mississauga toronto oakville etc exchange purchase must done th th january pm est order paid deadline buy ticket exchange payment on spot e transfer preferred personalize using information way everyone feel comfortable happening again abides tomorrowland rule completely reselling ticket simply selling opportunity purchase guaranteed ticket amazing event thanks attention good luck everyone interested,0,1,SELLING: 2 Guaranteed Tomorrowland 2015 Tickets (Canada Only)
692,9712,wanna buy hk audio linear speaker house dj got play them cheer,0,1,HK Audio Linear 3
877,12671,hi im trying find solution problem wondering someone idea help out parent big flat worth k different city room flat rented individually parent dont want involved anymore thats want pas sibling sell it think flat going increase value year due size location dont want sell it mentioned sibling live different country easy room time last time wedding different different opinion want move city manage tenant make reform flat taking room adding bathroom open kitchen live comfortably room rented cost reform around k im willing pay although dad would like make reform flat belongs sibling i want u agree reform pay it pay rent live rent free exchange managing flat understand fair flat belong sibling although know close impossible agree decision many discussion along way dont see eye eye different view almost everything point thought buying closest sister recently bought house doesnt money it neither i small amount put st payment meantime move house still belongs parent would able live rent free flat sibling before wouldnt allowed make change one going live city love flat want it would appreciate input idea would help me much appreciated,0,1,Family dispute over flat
1270,18689,looking buying house look like there vertical crack repaired foundation crack repaired inside exterior seems crack see issue this crack repaired year ago,2,1,Foundation crack repaired
1293,18817,hey guy maybe off topic question would like throw rave friend would like buy led light would look good smaller room preferably dime light red blue basic patter light strobe laser anyone experience ligts know related site forum could share checking light amazon guide aswell there many option many mixed review im completly lost,0,1,Rave / Party lightning [HELP]
1386,19697,love main aim currently number uk itunes chart people also buying tear whistle song great deal love frankie uk people greatly saddened lost legend wanted make small gesture,8,17,YSK that currently in the UK people are buying Frankie Knuckles records to get them into the charts
1463,20457,believe older house song could mistaken dj heard play club usually play lot older house song thinking one pretty fast beat song like slow ole go in male voice ole ole ole ole ole ole ole ole beat kick lot fast spanish vocal part pick ole quick like song song talking definately saying ole like faster please help,0,0,I need help finding a song. It's Spanish vocals (i think). And the only part I can pick out is the ole ole ole ole (similar to the soccer song but it is not that song or any version of it.)
1563,22062,hi guy posted r ukfunky age ago joy found subreddit thought might give shot may heard uk dj called perempay mix series called vibe really good never tracklist track track etc anyway vol track really really really want buy find anywhere anyone know is probably notice best quality file want proper version,6,4,First submission to /r/house! And it's a Track ID...
1566,22191,link buy inclined awesome mix deep house lover track lead it,2,0,"Recommend the mix ""One More Tune"" by Tom Middleton. Can't find it anywhere on youtube/soundcloud however."
1724,24996,interior always mandatory source decorating home really add beauty overall appeal reason numerous type flooring pattern adorning home talking terracotta floor tile provide impeccable finish flooring system terracotta clay heated fire made string enough carve floor well roof tile exclusive finish made via machine while hand made one texture visibility flooring made tile give smooth finish allow people feel elated sophisticated flooring plan,4,3,Flooring is an Important Part of Interiors
1761,25735,whenever go show stuff hear played kind thing percussion bass line maybe vocal know find kind stuff online buy recommendation thanks help,4,1,Where to find underground sounding house.
1835,27361,blog called dollar mix go buy worth vinyl new used record mix it mix usually house disco related also write new release based nyc area throw party called sunday soulstice month vbar st ave mix party come check u out enjoy,0,1,Here's a new blog I'm writing for House music.
1837,27378,always enjoy hearing howler people bought past think got absolute shite collection somewhere guilty pleasure drunk purchase young foolish track aged well record mp hide mate coming over would love hear some biggest offender trancey thing mid late since house reddit keep limited that particular order sgt slick white treble black bass bob marley v funkstar de luxe remix sun shining planet funk chase sun impossible think drunk lad dart hear now a t f c present one phat deeva life z factor gotta keep pushin roger sanchez never knew modjo lady even bring link one vocal grate much now bloody loved time though,11,6,Terrible records you bought?
2174,33742,heard song sample buying reocrds selling record several time cannot find sorry lack information help would appreciated think funky lo fi sorta vibe,2,1,"ID - Song with sample ""Buying records, selling records..."" Funky feel"
2650,37712,,0,1,Sullfupport - Cam Rillem
2865,39680,im looking buying one easily sync computer fl stuido,1,0,What are the best midi boards on the market?
2945,41093,process buying house plan making room lady cave like man cave lady now used scrapbooking knitting this movie video game etc need name it suggestion,0,1,What should I call my Lady Cave??
3171,44491,hello im college kid looking solid long mix playlist etc pop all day st paddy kegger morning looking upbeat hype fun carefree tune strong beat friend edm techno jam band dnb etc lol anyone perfect medium would insanely appreciated itll going wee hour recs considered point,1,1,ISO: St Paddy’s Party Mix Recommendations
3183,44615,last record bought last record buy hear first yesterday bought oldie shared list anyway unfinished business head first heard dinky play panorama bar end wanted since repressed last july mayday wiggin just randomly sumbled across looking rarity although got unofficial repress couldnt afford original round two new day what said one stone cold classic one smoothest deep track get finally kh track playing people keep asking joy used ra mix daphni played boiler room i seen posted facebook boomkat phonica never heard joy play really fan love track reminds mmm meet tshetsha boy released honest jons last year tama used smash quite bit,5,2,Dj's/Collectors of /r/House. What was the last vinyl purchase you made?
3251,45738,trying learn house dance class week live considering buying jardy online course anyone ever tried it lt website,0,1,Anyone try Jardy's New Online Course? [X-POST /r/HouseDancing]
3407,47851,hi guy able direct towards place buy house related artwork specifically poster wall art help appreciated cheer,2,1,House related art?
3669,52957,specifically want time rory cochrane remix visited beatport page seems down even sent dime recording email ago response really want buy it,0,1,Where Can I legitimately find this EP?
3694,54045,album version in mood full vocal heard essential mix here vocal mix exist somewhere searching time titled differently anyone could help much appreciated even though feel like track super exclusive edit never get greasy hand on,0,2,does the art department - in the mood vocal mix exist somewhere online?
3718,54779,vinyl sleeve got damaged place buy new original artwork cover record crystal castle iii,1,0,My vinyl cover got damaged is there a place you can buy new covers?
3948,59472,played bone lee well sound nightclub los angeles march nd go name house head believe,0,1,Looking for this track
4028,60189,planning buy piece land instead building house thinking buying prefab house good idea look looking prefab house,18,1,What to look for when buying a prefab house?
4082,60598,would buy house right lockdown lmao furniture anything modern got pool need recommendation like cleaning company maybe also laundry house task los angeles,1,1,Cleaning Company in LA?
4112,60871,quick recommendation elliot adamson coming uk producer brilliant edit series soundcloud latest one marlena shaw disco classic check others co great listen marlena shaw touch morning elliots edit elliot adamson soundcloud,4,1,Marlena Shaw - Touch Me In The Morning (Elliot Adamson Edit)
4159,61260,find digital copy astro astro anyone link buy it download free it free download iirc astro astro,6,3,"Astro - Astro (can't find a digital copy anywhere, please help)"
4193,61513,luister naar highly sensitive van senne buyens op soundcloud,0,1,Senne Buyens - highly sensitive ( trying to express hope in a song )
4194,61514,luister naar highly sensitive van senne buyens op soundcloud,0,1,Senne Buyens - highly sensitive ( trying to express hope in a song )
4208,61587,point direction free downloads buy tonne figure must healthy amount good freebie floating around,0,1,Free House Downloads request
4307,62914,u guy called like much would cost buy new one least ask new one,0,1,what is this?
4374,63711,buy sell abc buildcon pvt ltd mapsko mount ville offer bhk luxury appartments sector near nh gurgaon,1,1,Mapsko Mount Ville Gurgaon at Sector 79
4512,66068,this itunes link let uk user buy anyone know get u,9,2,Trying to find a place to download Artful Dodger in the US. Anyone know one? 
4679,68253,regret home purchase distance bought outside city work home overpriced falling apart much competition bidding process house love brand new build growing area location like anymore six month feeling depression year old single living suburb one close age time felt house area right choice feel made huge mistake plan best tough month place make full two year avoid owing capital gain may make end year one hope rent place keep make profit end sell road anyone else put situation regret buying place,1,1,Regretting my home purchase
4704,69281,last year tech house become super popular find incredibly boring seems thud along little variation track sound same love house many friend say get bored repetitive tech house definitely understand coming from buy mix see many artist tech house set night want go home get sleep set becomes samey last week saw route t e e d tech house set bored senseless usually like artist really want trend end think super popular ibiza continues go on realise tech house done well dun dun example majority wank commerically made sell beatport top wunderground article got spot derision tech house anyone fan agree me,36,1,Anyone else bored to death with this tech house trend?
4813,74897,theoretically could album similar may like could buy him rather bunch song could load onto sweet cd getting him want house related bit try snag specific song name like guy tomorrow have help edit please tell fit better r proghouse something familiar genre myself,0,2,"Hey! My friend likes the sort of music from Project 46 and the like, I need help for a Christmas gift for him."
4845,75767,something interesting moti turn vip mix however check song beatport streaming different mix same title though even move interesting use buy beatport store link streaming service lead here mix first youtube link is looking version streaming service imho version way better want use set google shazam everything find link buy version halp,0,2,"Help me find a track! MOTi - Turn me Up, alternative mix (aka, not the VIP mix)"
