,index,selftext,num_comments,score,title
440,7105,hey everyone girlfriend one first people canada register tomorrowland guarantee u tomorrowland package go sale proof ticket sold worldwide spot purchasing queue fill le second guarantee waiting year this need package willing part two experience lifetime opportunity deal serious inquiry only canadian willing meet gta ontario only excludes single day pass dreamville friendship package interested guaranteeing package tomorrowland email adina i tomorrowland gmail com email include name phone number package looking buy and much willing pay them baseline price select top offer a backup incase first offer flop contact via email th january set meet public place within gta mississauga toronto oakville etc exchange purchase must done th th january pm est order paid deadline buy ticket exchange payment on spot e transfer preferred personalize using information way everyone feel comfortable happening again abides tomorrowland rule completely reselling ticket simply selling opportunity purchase guaranteed ticket amazing event thanks attention good luck everyone interested,0,1,SELLING: 2 Guaranteed Tomorrowland 2015 Tickets (Canada Only)
613,8762,recently posted desolat opening context submitted for got accepted final round requested record live final submit whoever give listen share dm feedback possible would appreciated enjoy edit asking price invitation part desolat big party anniversary chance listen demo ep so kinda lifetime opportunity,0,1,"Desolat, Loco Dice's Label, forwarded my mix to the final round (Thanks to some of you)!!"
748,10626,favorite house producer overall like kyle watson vonstroke prefer view poll,3,1,Kyle Watson or Claude Vonstroke?
756,10670,latest monthly deep house mix tampella industrial operation shut moved away tampella district area saw new era urban development old industrial facility demolished new residential area emerged latest development ranta tampella lakeside neighbourhood built partially artificial island embankment home nearly people planned new neighbourhood beautiful urban nature view minute walk city center due unique location however come price literally penthouse apartment price tag nearly million euro tracklist alva slow virage hatt d bamboo virage tominori hosoya child world virage andrey djackonda closer not label alva bounce feat davelly virage munir nadir guru oden amp fatzo remix smoud traxx kcik kcik kcik nphs teaboy virage djoko bad bone shall fade chris stussy toman timewriter locus hart amp neeran sect do sleep edmondson masquerade lissoms alkalino dancing somebody audaz,0,1,[MIX MONDAY] Tampella 005 (deep house)
2068,32914,anyone insight find good production pack cost ton beatport seem pricey low quality familiar place go thanks,6,1,Good Production Packs for Disco/Deep House?
4518,66140,im interested know much booking dj cost anyone experience booking dj different popularity please let know rough price range,7,1,PROMOTERS: How much do DJs charge?
4679,68253,regret home purchase distance bought outside city work home overpriced falling apart much competition bidding process house love brand new build growing area location like anymore six month feeling depression year old single living suburb one close age time felt house area right choice feel made huge mistake plan best tough month place make full two year avoid owing capital gain may make end year one hope rent place keep make profit end sell road anyone else put situation regret buying place,1,1,Regretting my home purchase
